{
  "schema_version": "net.node.identity.v1",
  "node_id": "node_lan_demo",
  "node_label": "LAN node demo",
  "node_kind": "lan",
  "node_scope": "lan",
  "node_state": "declared",
  "identity_source": "fixture_declared",
  "safe_metadata": {
    "role": "lan_candidate",
    "environment": "demo",
    "declared_by": "net_spine_3",
    "note": "no discovery performed"
  },
  "observed_at_unix_ms": 1700000010200,
  "endpoint_refs": ["endpoint_demo_lan_http"],
  "capability_refs": ["capability_demo_generic_external"]
}
