{
  "schema_version": "net.node.identity.v1",
  "node_id": "node_local_process_demo",
  "node_label": "Local process demo",
  "node_kind": "local",
  "node_scope": "process",
  "node_state": "declared",
  "identity_source": "fixture_declared",
  "safe_metadata": {
    "role": "local_process",
    "environment": "demo",
    "declared_by": "net_spine_3",
    "note": "safe local process projection"
  },
  "observed_at_unix_ms": 1700000010000,
  "endpoint_refs": ["endpoint_demo_local_process"],
  "capability_refs": ["capability_demo_metrics_stream"]
}
