{
  "schema_version": "net.node.identity.v1",
  "node_id": "node_remote_demo",
  "node_label": "Remote node demo",
  "node_kind": "remote",
  "node_scope": "remote",
  "node_state": "declared",
  "identity_source": "fixture_declared",
  "safe_metadata": {
    "role": "remote_candidate",
    "environment": "demo",
    "declared_by": "net_spine_3",
    "note": "no remote discovery performed"
  },
  "observed_at_unix_ms": 1700000010300,
  "endpoint_refs": ["endpoint_demo_remote_http"],
  "capability_refs": ["capability_demo_generic_external"]
}
