{
  "schema_version": "net.node.identity.v1",
  "node_id": "node_external_demo",
  "node_label": "External node demo",
  "node_kind": "external",
  "node_scope": "external",
  "node_state": "declared",
  "identity_source": "fixture_declared",
  "safe_metadata": {
    "role": "external_capability_node",
    "environment": "demo",
    "declared_by": "net_spine_3",
    "note": "generic external node projection"
  },
  "observed_at_unix_ms": 1700000010400,
  "endpoint_refs": ["endpoint_demo_external"],
  "capability_refs": ["capability_demo_neural_llm_decode"]
}
