{
  "schema_version": "net.node.identity.v1",
  "node_id": "node_localhost_service_demo",
  "node_label": "Loopback service demo",
  "node_kind": "localhost_service",
  "node_scope": "machine",
  "node_state": "declared",
  "identity_source": "fixture_declared",
  "safe_metadata": {
    "role": "loopback_service",
    "environment": "demo",
    "declared_by": "net_spine_3",
    "note": "no real port or host claim"
  },
  "observed_at_unix_ms": 1700000010100,
  "endpoint_refs": ["endpoint_demo_localhost_http"],
  "capability_refs": ["capability_demo_receipt_emit"]
}
